{"case_id":"commons-math-defects4j-MATH-927","source":"Apache Commons JIRA","source_url":"https://issues.apache.org/jira/browse/MATH-927","publication_date":"2013-01-04","technology":"Apache Commons Math / Java","error_description":"GammaDistribution serialization/cloning fails through the non-serializable BitsStreamGenerator dependency.","evidence_urls":["https://issues.apache.org/jira/browse/MATH-927","https://commons.apache.org/proper/commons-math/changes-report.html"],"split":"candidates","annotation_status":"not_started","provenance_verification_status":"unverified"}
