{
  "case_id": "commons-math-defects4j-MATH-949",
  "source": "Apache Commons JIRA",
  "source_url": "https://issues.apache.org/jira/browse/MATH-949",
  "publication_date": "2013-03-15",
  "technology": "Apache Commons Math / Java / Optimization",
  "error_description": "An optimizer bookkeeping value was not updated as expected.",
  "evidence_urls": [
    "https://issues.apache.org/jira/browse/MATH-949",
    "https://commons.apache.org/proper/commons-math/changes-report.html"
  ],
  "split": "candidates",
  "annotation_status": "not_started",
  "provenance_verification_status": "unverified"
}
