{
  "case_id": "commons-math-defects4j-MATH-950",
  "source": "Apache Commons JIRA",
  "source_url": "https://issues.apache.org/jira/browse/MATH-950",
  "publication_date": "2013-03-19",
  "technology": "Apache Commons Math / Java / ODE",
  "error_description": "ODE event handling failed to update state correctly when RESET_STATE was triggered.",
  "evidence_urls": [
    "https://issues.apache.org/jira/browse/MATH-950",
    "https://commons.apache.org/proper/commons-math/changes-report.html"
  ],
  "split": "candidates",
  "annotation_status": "not_started",
  "provenance_verification_status": "unverified"
}
