{"case_id":"commons-math-defects4j-MATH-988","source":"Apache Commons JIRA","source_url":"https://issues.apache.org/jira/browse/MATH-988","publication_date":"2013-06-02","technology":"Apache Commons Math / Java / 3D Geometry","error_description":"A null-related failure could occur in sub-line intersection handling.","evidence_urls":["https://issues.apache.org/jira/browse/MATH-988","https://commons.apache.org/proper/commons-math/changes-report.html"],"split":"candidates","annotation_status":"not_started","provenance_verification_status":"unverified"}
